"Headline","Join True Religion: Innovate"
"Headline","Lead Culver City's Top Store"
"Headline","Success at True Religion"
"Headline","Drive Retail Growth with Us"
"Headline","Career Growth in Retail"
"Headline","True Religion: Leader's Choice"
"Headline","Elevate Your Career"
"Headline","Retail Excellence Awaits"
"Headline","Craft Your Future in Retail"
"Headline","Lead & Excel with True Religion"
"Headline","Transform Retail with Skills"
"Headline","Culver Awaits Leadership"
"Headline","True Religion: Beyond Ordinary"
"Headline","Retail Leadership Redefined"
"Headline","Innovate and Lead in Retail"
"Long Headline","Join True Religion in Culver City and Lead the Future of Innovative Retail"
"Long Headline","Manage and Grow with True Religion: A Career in Retail Leadership"
"Long Headline","Elevate Your Career with True Religion in High-End Retail Management"
"Long Headline","Lead Culver City's Premier Retail Store and Drive Exceptional Results"
"Long Headline","True Religion Seeks a Visionary Leader in Culver City"
"Description","Manage a top store and lead a team to success. Apply now!"
"Description","Seeking a skilled manager to drive performance and sales. Join us!"
"Description","Lead True Religion's Culver City store to new heights. Apply today!"
"Description","Excel in a career that values innovation and leadership. Start with us!"
"Description","Drive growth and success in a leading retail environment."
